Sheet: Sheet1
B1: 국어 | C1: 영어 | D1: 수학 | E1: 과학 | F1: 역사
A2: 20240001 | B2: =RANDBETWEEN(51,100) -> 68 | C2: =RANDBETWEEN(51,100) -> 65 | D2: =RANDBETWEEN(51,100) -> 56 | E2: =RANDBETWEEN(51,100) -> 96 | F2: =RANDBETWEEN(51,100) -> 97
A3: 20240002 | B3: =RANDBETWEEN(51,100) -> 59 | C3: =RANDBETWEEN(51,100) -> 67 | D3: =RANDBETWEEN(51,100) -> 69 | E3: =RANDBETWEEN(51,100) -> 61 | F3: =RANDBETWEEN(51,100) -> 55
A4: 20240003 | B4: =RANDBETWEEN(51,100) -> 58 | C4: =RANDBETWEEN(51,100) -> 66 | D4: =RANDBETWEEN(51,100) -> 92 | E4: =RANDBETWEEN(51,100) -> 88 | F4: =RANDBETWEEN(51,100) -> 89
A5: 20240004 | B5: =RANDBETWEEN(51,100) -> 96 | C5: =RANDBETWEEN(51,100) -> 100 | D5: =RANDBETWEEN(51,100) -> 77 | E5: =RANDBETWEEN(51,100) -> 68 | F5: =RANDBETWEEN(51,100) -> 96
A6: 20240005 | B6: =RANDBETWEEN(51,100) -> 63 | C6: =RANDBETWEEN(51,100) -> 81 | D6: =RANDBETWEEN(51,100) -> 91 | E6: =RANDBETWEEN(51,100) -> 59 | F6: =RANDBETWEEN(51,100) -> 100
A7: 20240006 | B7: =RANDBETWEEN(51,100) -> 63 | C7: =RANDBETWEEN(51,100) -> 96 | D7: =RANDBETWEEN(51,100) -> 65 | E7: =RANDBETWEEN(51,100) -> 69 | F7: =RANDBETWEEN(51,100) -> 76
A8: 20240007 | B8: =RANDBETWEEN(51,100) -> 77 | C8: =RANDBETWEEN(51,100) -> 77 | D8: =RANDBETWEEN(51,100) -> 80 | E8: =RANDBETWEEN(51,100) -> 67 | F8: =RANDBETWEEN(51,100) -> 77
A9: 20240008 | B9: =RANDBETWEEN(51,100) -> 83 | C9: =RANDBETWEEN(51,100) -> 55 | D9: =RANDBETWEEN(51,100) -> 51 | E9: =RANDBETWEEN(51,100) -> 88 | F9: =RANDBETWEEN(51,100) -> 81
A10: 20240009 | B10: =RANDBETWEEN(51,100) -> 73 | C10: =RANDBETWEEN(51,100) -> 64 | D10: =RANDBETWEEN(51,100) -> 92 | E10: =RANDBETWEEN(51,100) -> 89 | F10: =RANDBETWEEN(51,100) -> 56
A11: 20240010 | B11: =RANDBETWEEN(51,100) -> 98 | C11: =RANDBETWEEN(51,100) -> 58 | D11: =RANDBETWEEN(51,100) -> 67 | E11: =RANDBETWEEN(51,100) -> 94 | F11: =RANDBETWEEN(51,100) -> 63